{
  "epic_id": "sprint-0",
  "graph_id": "sprint-0-execution-graph",
  "work_packages": [
    {
      "id": "#517",
      "type": "code",
      "repo": "ga",
      "description": "Infrastructure bootstrap - ga-react-components",
      "blocks": ["#519"]
    },
    {
      "id": "#519",
      "type": "code",
      "repo": "tars",
      "description": "API Integration layer - tars to ga",
      "should_merge_after": ["#527"]
    },
    {
      "id": "#520",
      "type": "code",
      "repo": "ix",
      "description": "Core ML pipelines - ix",
      "depends_on": ["#523"]
    },
    {
      "id": "#523",
      "type": "test",
      "repo": "ix",
      "description": "E2E Integration tests for ML pipelines",
      "blocks": ["#525"]
    },
    {
      "id": "#525",
      "type": "doc",
      "repo": "demerzel",
      "description": "Sprint 0 completion report",
      "reviews": ["#527"]
    },
    {
      "id": "#527",
      "type": "review",
      "repo": "demerzel",
      "description": "Final governance review for Sprint 0"
    }
  ],
  "review_stages": [
    {
      "stage_id": "governance-final-review",
      "target_nodes": ["#527"],
      "reviewers": ["Demerzel", "Skeptical-Auditor"],
      "verdict": "pending"
    }
  ],
  "merge_stages": [
    {
      "stage_id": "sprint-0-main-merge",
      "order": 1,
      "target_nodes": ["#517", "#519", "#520", "#523"],
      "target_branch": "main"
    }
  ],
  "metadata": {
    "sprint": "Sprint 0",
    "owner": "Jules",
    "created_at": "2026-06-22T12:00:00Z"
  }
}
